{
  "schema": "specmetry.status/v1",
  "as_of_seq": 412,
  "project": {
    "id": "01J9Z3K5Q8R2T4V6W8X0Y2Z4C1",
    "name": "demo",
    "stage": "in_development",
    "sources_skipped": false,
    "inventory_skipped": false
  },
  "baseline_version": 4,
  "init_progress": "inventoried",
  "inventory_coverage": 1,
  "source_set_hash": "3b5d9f0c1e2a4b6c8d0e1f2a3b4c5d6e7f8091a2b3c4d5e6f708192a3b4c5d6e",
  "target": {
    "id": "01J9Z3K5Q8R2T4V6W8X0Y2Z4B0",
    "name": "首期交付",
    "ref": "refs/heads/main",
    "snapshot": "8f3c2a1b9d7e6f5a4b3c2d1e0f9a8b7c6d5e4f3a"
  },
  "scope": {
    "confirmation_id": "01J9Z3K5Q8R2T4V6W8X0Y2Z4D0",
    "baseline_version": 4,
    "source_set_hash": "3b5d9f0c1e2a4b6c8d0e1f2a3b4c5d6e7f8091a2b3c4d5e6f708192a3b4c5d6e",
    "stale": false,
    "requirements": [
      "REQ-002"
    ]
  },
  "delivery": {
    "status": "ready_for_review",
    "evidence_grade": "observed",
    "blocking_gaps": [
      {
        "type": "AWAITING_REVIEW",
        "blocking": true,
        "target_key": "AC-002-2",
        "reason": "first_review",
        "next_action": "人工验收"
      }
    ]
  },
  "workspace": {
    "worktree_id": "01J9Z3K5Q8R2T4V6W8X0Y2Z4D1",
    "path": "/home/dev/demo",
    "head": "8f3c2a1b9d7e6f5a4b3c2d1e0f9a8b7c6d5e4f3a",
    "tree_state": "clean",
    "is_target_snapshot": true,
    "compare_from": {
      "commit": "1a2b3c4d5e6f7a8b9c0d1e2f3a4b5c6d7e8f9a0b",
      "source": "previous_batch"
    },
    "changed_paths": [
      "internal/orders/query.go",
      "internal/orders/isolation_test.go"
    ]
  },
  "goals": [
    {
      "key": "GOAL-1",
      "revision": 1,
      "title": "上线订单管理 MVP"
    }
  ],
  "sources": [
    {
      "id": "01J9Z3K5Q8R2T4V6W8X0Y2Z4E0",
      "path": "docs/client-brief.md",
      "kind": "client_requirement",
      "acked_sha256": "9a8b7c6d5e4f3a2b1c0d9e8f7a6b5c4d3e2f1a0b9c8d7e6f5a4b3c2d1e0f9a8b",
      "current_sha256": "9a8b7c6d5e4f3a2b1c0d9e8f7a6b5c4d3e2f1a0b9c8d7e6f5a4b3c2d1e0f9a8b",
      "state": "unchanged"
    }
  ],
  "requirements": [
    {
      "key": "REQ-002",
      "revision": 2,
      "goal": "GOAL-1",
      "title": "用户只能查看自己的订单",
      "priority": "must",
      "in_scope": true,
      "status": "ready_for_review",
      "flags": [],
      "criteria": [
        {
          "key": "AC-002-1",
          "revision": 1,
          "requirement_revision": 2,
          "verification": "automated",
          "has_check": true,
          "check_config_hash": "aa11bb22cc33dd44ee55ff66aa77bb88cc99dd00ee11ff22aa33bb44cc55dd66",
          "delivery_status": "accepted",
          "reason": "direct",
          "progress": "claimed",
          "flags": [
            "observed_evidence"
          ],
          "current_decision_id": "01J9Z3K5Q8R2T4V6W8X0Y2Z4F2",
          "decision": {
            "id": "01J9Z3K5Q8R2T4V6W8X0Y2Z4F2",
            "seq": 408,
            "decision": "accepted",
            "mode": "normal",
            "snapshot": "8f3c2a1b9d7e6f5a4b3c2d1e0f9a8b7c6d5e4f3a",
            "evidence_grade": "observed",
            "rationale": null
          },
          "snapshot_run": {
            "evidence_id": "01J9Z3K5Q8R2T4V6W8X0Y2Z4D2",
            "seq": 401,
            "result": "pass",
            "failure_kind": null,
            "qualifying": true,
            "evidence_grade": "observed"
          },
          "workspace_run": null
        },
        {
          "key": "AC-002-2",
          "revision": 1,
          "requirement_revision": 2,
          "verification": "automated",
          "has_check": true,
          "check_config_hash": "bb11bb22cc33dd44ee55ff66aa77bb88cc99dd00ee11ff22aa33bb44cc55dd66",
          "delivery_status": "ready_for_review",
          "reason": "first_review",
          "progress": "claimed",
          "flags": [],
          "current_decision_id": null,
          "snapshot_run": {
            "evidence_id": "01J9Z3K5Q8R2T4V6W8X0Y2Z4B1",
            "seq": 405,
            "result": "pass",
            "qualifying": true,
            "evidence_grade": "observed"
          },
          "workspace_run": null
        }
      ]
    }
  ],
  "open_questions": [],
  "gaps": [
    {
      "type": "AWAITING_REVIEW",
      "blocking": true,
      "target_key": "AC-002-2",
      "reason": "first_review",
      "next_action": "人工验收"
    },
    {
      "type": "PENDING_REVIEW",
      "blocking": false,
      "target_key": null,
      "reason": null,
      "next_action": "审核提案"
    }
  ],
  "metrics": {
    "scope_acceptance_ratio": 0,
    "ac_status_counts": {
      "accepted": 1,
      "ready_for_review": 1
    },
    "claimed_without_evidence": 0,
    "pending_review_items": 2,
    "open_questions": 0,
    "blocking_questions": 0,
    "exception_acceptances": 0,
    "observed_evidence_acceptances": 1
  },
  "diff_since_seq": 400,
  "changes_since": [
    {
      "criterion": "AC-002-2",
      "field": "delivery_status",
      "from": "in_progress",
      "to": "ready_for_review"
    }
  ]
}
